question,answer
Bagaimana cara memastikan tanaman padi tetap sehat?,"Untuk memastikan tanaman padi tetap sehat, pastikan sistem irigasi berfungsi dengan baik, berikan pupuk sesuai kebutuhan, dan lakukan pemantauan rutin terhadap hama dan penyakit."
Apa saja tanda-tanda tanaman padi yang sehat?,"Tanda-tanda tanaman padi yang sehat meliputi daun hijau segar, batang kuat, akar yang berkembang baik, dan tidak ada tanda-tanda infeksi hama atau penyakit."
Apa itu hama hispa pada padi?,"Hama hispa adalah serangga yang menyerang daun padi dengan cara menggerogoti permukaan daun, menyebabkan daun menjadi berlubang dan mengurangi fotosintesis."
Bagaimana cara mengendalikan hama hispa pada padi?,"Pengendalian hama hispa dapat dilakukan dengan aplikasi insektisida yang tepat, menjaga kebersihan sawah, dan menanam varietas padi yang tahan terhadap hama hispa."
Apa gejala serangan hama hispa pada padi?,"Gejala serangan hama hispa meliputi daun yang berlubang-lubang dan menguning, serta pertumbuhan tanaman yang terhambat."
Apa penyebab penyakit blas pada daun padi?,"Penyakit blas pada daun padi disebabkan oleh jamur Pyricularia oryzae yang menyerang bagian daun, leher, dan bulir padi."
Bagaimana cara mengatasi penyakit blas pada daun padi?,"Cara mengatasi penyakit blas termasuk penggunaan fungisida, menanam varietas padi yang tahan blas, dan menjaga kebersihan lahan."
Apa saja gejala penyakit blas pada daun padi?,Gejala penyakit blas pada daun padi meliputi adanya bercak berbentuk berlian dengan tepi berwarna coklat atau abu-abu dan bagian tengah yang lebih terang.
Apa penyebab bercak coklat pada daun padi?,"Bercak coklat pada daun padi disebabkan oleh jamur Cochliobolus miyabeanus yang menyerang daun, tangkai, dan biji padi."
Bagaimana cara mengendalikan penyakit bercak coklat pada padi?,"Pengendalian bercak coklat dapat dilakukan dengan rotasi tanaman, penggunaan fungisida, dan penanaman varietas yang tahan terhadap penyakit ini."
Apa gejala penyakit bercak coklat pada padi?,Gejala penyakit bercak coklat meliputi bercak kecil berwarna coklat pada daun yang kemudian membesar dan menyebabkan daun mengering.
Bagaimana cara menjaga kesuburan tanah sawah?,"Menjaga kesuburan tanah sawah dapat dilakukan dengan rotasi tanaman, penambahan bahan organik seperti kompos atau pupuk kandang, dan pengelolaan pH tanah."
Kapan waktu terbaik untuk menanam padi agar tetap sehat?,"Waktu terbaik untuk menanam padi adalah pada awal musim hujan, ketika curah hujan cukup tinggi untuk mendukung pertumbuhan tanaman."
Bagaimana cara memantau kesehatan tanaman padi?,"Memantau kesehatan tanaman padi bisa dilakukan dengan inspeksi visual rutin, memeriksa daun, batang, dan akar untuk tanda-tanda hama atau penyakit, serta melakukan uji tanah dan air secara berkala."
Apa yang menyebabkan populasi hama hispa meningkat?,"Populasi hama hispa meningkat biasanya disebabkan oleh kondisi lingkungan yang mendukung seperti cuaca panas dan lembab, serta kurangnya predator alami."
Apakah ada varietas padi yang tahan terhadap hama hispa?,"Ya, beberapa varietas padi telah dikembangkan untuk tahan terhadap hama hispa, seperti varietas yang memiliki daun yang lebih tebal atau mengandung senyawa penolak hama."
Bagaimana cara alami mengendalikan hama hispa?,"Cara alami mengendalikan hama hispa termasuk penggunaan predator alami seperti laba-laba dan kepik, serta penanaman tanaman penghalang di sekitar sawah."
Apa dampak dari serangan hama hispa pada hasil panen?,"Serangan hama hispa dapat mengurangi hasil panen dengan signifikan karena hama ini merusak daun yang merupakan bagian penting untuk fotosintesis, sehingga tanaman menjadi kurang produktif."
Apakah kondisi cuaca mempengaruhi penyebaran penyakit blas daun?,"Ya, kondisi cuaca yang lembab dan suhu yang hangat sangat mendukung penyebaran jamur penyebab penyakit blas daun."
Apa yang bisa dilakukan petani saat melihat gejala awal penyakit blas?,"Saat melihat gejala awal penyakit blas, petani sebaiknya segera mengaplikasikan fungisida yang tepat, mengurangi kelembaban di sekitar tanaman, dan memisahkan tanaman yang terinfeksi untuk mencegah penyebaran."
Bagaimana pengaruh penyakit blas daun terhadap kualitas biji padi?,"Penyakit blas daun dapat mempengaruhi kualitas biji padi dengan menyebabkan biji menjadi hampa atau tidak matang dengan sempurna, sehingga mengurangi kualitas dan kuantitas hasil panen."
Apakah penggunaan fungisida secara rutin efektif untuk mencegah penyakit blas daun?,"Penggunaan fungisida secara rutin bisa efektif untuk mencegah penyakit blas daun, namun harus digunakan sesuai dengan anjuran untuk mencegah resistensi jamur."
Bagaimana cara mencegah penyebaran penyakit bercak coklat?,"Pencegahan penyebaran penyakit bercak coklat meliputi rotasi tanaman, pengelolaan air yang baik, pengurangan kelembaban dengan pengaturan jarak tanam, dan penggunaan fungisida preventif."
Apa saja tanda-tanda awal dari penyakit bercak coklat pada padi?,Tanda-tanda awal dari penyakit bercak coklat meliputi bercak kecil berwarna coklat atau hitam pada daun yang lama kelamaan membesar dan menyebabkan daun mengering.
Bagaimana cara memperbaiki tanaman padi yang sudah terkena penyakit bercak coklat?,"Untuk memperbaiki tanaman padi yang sudah terkena penyakit bercak coklat, lakukan pemangkasan daun yang terinfeksi, aplikasikan fungisida yang sesuai, dan tingkatkan nutrisi dengan pemberian pupuk yang tepat."
Bagaimana cara menggunakan fitur scan untuk mendeteksi penyakit pada daun padi,"Untuk menggunakan fitur ini, buka aplikasi dan pilih opsi ""Scan Tanaman"". Arahkan kamera ponsel Anda ke daun padi yang ingin Anda periksa dan ambil foto. Aplikasi akan menganalisis gambar dan memberikan diagnosa penyakit yang terdeteksi."
Apakah scan tanaman ini bisa dilakukan dalam kondisi cahaya rendah?,"Untuk hasil yang optimal, lakukan scan tanaman di kondisi pencahayaan yang baik. Cahaya yang cukup membantu aplikasi dalam menganalisis gambar dengan lebih akurat. Anda bisa melihat panduan scan tanaman pada menu ""Scan Tips"" di kamera deteksi"
Bagaimana cara membuat jadwal perawatan tanaman padi di aplikasi ini?,"Untuk membuat jadwal perawatan, masuk ke menu ""Care Schedule"", pilih jenis perawatan yang ingin Anda jadwalkan, tentukan tanggal dan waktu, lalu simpan. Aplikasi akan mengingatkan Anda sesuai jadwal yang telah dibuat."
Apakah saya bisa mengedit atau menghapus jadwal perawatan yang sudah dibuat?,"Ya, Anda bisa mengedit atau menghapus jadwal perawatan kapan saja. Masuk ke menu ""Care Schedule, pilih jadwal yang ingin Anda ubah atau hapus, lalu lakukan perubahan yang diperlukan."
Apa saja yang bisa saya temukan di blog berita mengenai padi?,"Di blog berita, Anda bisa menemukan berbagai artikel, tips, dan berita terbaru mengenai padi, termasuk metode perawatan, perkembangan teknologi pertanian, dan informasi lain yang bermanfaat bagi petani."
Apakah saya bisa berkontribusi artikel di blog berita ini?,"Saat ini, fitur kontribusi artikel belum tersedia. Namun, kami selalu terbuka untuk masukan dan saran. Anda bisa menghubungi tim kami melalui laman profil atau kontak yang tersedia di aplikasi."
Bagaimana cara melihat riwayat scan tanaman padi yang telah saya lakukan?,"Untuk melihat riwayat scan, masuk ke menu ""History"". Di sana, Anda akan menemukan daftar scan yang telah Anda lakukan beserta hasil diagnosa dan tanggal scan."
